{
  "product": "oracle-goldengate",
  "version": "23.8.0.25.04",
  "release_label": "Release 23.8.0.25.04- April 2025",
  "last_updated": "2026-05-30",
  "sections": {
    "certification": [],
    "whats_new": [],
    "behavior_changes": [
      {
        "title": "Bug 37757820: Generic - Enable NOCHECKUNIQUEKEYS as default for BATCHSQL for all Non-Oracle AI Databases",
        "description": "Enabled NOCHECKUNIQUEKEYS as default for BATCHSQL for all non- Oracle AI Database .",
        "source_url": "https://docs.oracle.com/en/database/goldengate/core/26/release-notes/default-behaviour-updates-23ai.html#GUID-BD631C70-4D97-410D-9E8E-031C1241E565"
      },
      {
        "title": "Bug 29709965: MySQL - Extract to skip XA transactions and log a Warning instead of Abend",
        "description": "Changed the functionality in Oracle GoldenGate Extract for MySQL to skip XA transactions with a warning, instead of abending.",
        "source_url": "https://docs.oracle.com/en/database/goldengate/core/26/release-notes/default-behaviour-updates-23ai.html#GUID-BD631C70-4D97-410D-9E8E-031C1241E565"
      },
      {
        "title": "Bug 37465578: MySQL - Change the default capture for Extract CDC to be remote capture",
        "description": "Changed the default capture of Oracle GoldenGate for MySQL from local to remote capture for Linux-x64 platform.",
        "source_url": "https://docs.oracle.com/en/database/goldengate/core/26/release-notes/default-behaviour-updates-23ai.html#GUID-BD631C70-4D97-410D-9E8E-031C1241E565"
      }
    ],
    "deprecated": [],
    "desupported": []
  }
}