{
  "product": "oracle-goldengate",
  "version": "23.10.0.25.10",
  "release_label": "Release 23.10.0.25.10- October 2025",
  "last_updated": "2026-05-30",
  "sections": {
    "certification": [],
    "whats_new": [],
    "behavior_changes": [
      {
        "title": "Bug 37236254: Generic - Change default trail file size from 500MB to 2GB",
        "description": "Updated the default trail file size from 500MB to 2GB.",
        "source_url": "https://docs.oracle.com/en/database/goldengate/core/26/release-notes/default-behaviour-updates-23ai.html#GUID-BD631C70-4D97-410D-9E8E-031C1241E565"
      }
    ],
    "deprecated": [],
    "desupported": []
  }
}