{
  "product": "oracle-goldengate",
  "version": "23.7",
  "release_label": "Release 23.7: January 2025",
  "last_updated": "2026-05-30",
  "sections": {
    "certification": [],
    "whats_new": [
      {
        "title": "Oracle GoldenGate supports capture from standby from PostgreSQL 16 onwards",
        "description": "Oracle GoldenGate supports capture from PostgreSQL standby database from PostgreSQL version 16 and higher.",
        "source_url": "https://docs.oracle.com/en/database/goldengate/core/26/release-notes/new-features.html#GUID-D85D0190-05E6-47A3-9C1D-3645C2CBCBCB"
      },
      {
        "title": "Oracle GoldenGate Extract supports capture from OCI PostgreSQL",
        "description": "Oracle GoldenGate Extract supported for OCI PostgreSQL.",
        "source_url": "https://docs.oracle.com/en/database/goldengate/core/26/release-notes/new-features.html#GUID-D85D0190-05E6-47A3-9C1D-3645C2CBCBCB"
      }
    ],
    "behavior_changes": [],
    "deprecated": [],
    "desupported": []
  }
}